{
  "sourceRequirements": [
    {
      "id": "FR1",
      "originalText": "1. FR1: A user on the login page can click \"Forgot password\" to enter their registered email address and request a reset link."
    },
    {
      "id": "FR2",
      "originalText": "2. FR2: If the email matches a registered account, the system sends a reset link to that email; the link is valid for 30 minutes from send time. If the email does not match any account, the system shows the same generic confirmation message (no account-enumeration signal)."
    },
    {
      "id": "FR3",
      "originalText": "3. FR3: Clicking a valid, unexpired reset link takes the user to a form to enter and confirm a new password."
    },
    {
      "id": "FR4",
      "originalText": "4. FR4: A new password must be at least 12 characters and contain at least one letter and one number. If it does not meet these rules, the system rejects it and shows the specific unmet rule(s)."
    },
    {
      "id": "FR5",
      "originalText": "5. FR5: On successful password change, the system invalidates the reset link, invalidates all existing login sessions for that account, and displays a confirmation that the user can now log in with the new password."
    },
    {
      "id": "FR6",
      "originalText": "6. FR6: If a reset link is expired or already used, the system shows an error and offers to send a new one (returning to FR1's flow)."
    }
  ],
  "useCaseId": "UC-PASSWORD-RESET",
  "intent": "Allows a user to reset their forgotten password and regain access to their account.",
  "role": "User",
  "preconditions": [
    "User is on the login page"
  ],
  "postconditions": [
    "User informed of successful password change and ability to log in"
  ],
  "basicFlow": {
    "steps": [
      {
        "stepId": "1",
        "actor": "User",
        "action": "request",
        "businessObject": "Password Reset Link",
        "sourceText": "1. FR1: A user on the login page can click \"Forgot password\" to enter their registered email address and request a reset link.",
        "sourceRequirementId": "FR1",
        "toActor": "System",
        "precondition": "User is on the login page",
        "postcondition": "User has requested a password reset link for an Account",
        "description": "The User requests a Password Reset Link from the System."
      },
      {
        "stepId": "2",
        "actor": "System",
        "action": "send",
        "businessObject": "Password Reset Link",
        "sourceText": "2. FR2: If the email matches a registered account, the system sends a reset link to that email; the link is valid for 30 minutes from send time. If the email does not match any account, the system shows the same generic confirmation message (no account-enumeration signal).",
        "sourceRequirementId": "FR2",
        "toActor": "User",
        "precondition": "User has requested a password reset link for an Account; Email matches a registered account",
        "postcondition": "Password Reset Link sent to User's email; Password Reset Link is valid for 30 minutes",
        "description": "The System sends a Password Reset Link to the User."
      },
      {
        "stepId": "3",
        "actor": "User",
        "action": "access",
        "businessObject": "Account",
        "sourceText": "3. FR3: Clicking a valid, unexpired reset link takes the user to a form to enter and confirm a new password.",
        "sourceRequirementId": "FR3",
        "toActor": "System",
        "precondition": "User has received a valid, unexpired Password Reset Link",
        "postcondition": "User is presented with a form to enter and confirm a new Password",
        "description": "The User accesses their Account via the System."
      },
      {
        "stepId": "4",
        "actor": "User",
        "action": "submit",
        "businessObject": "Account",
        "sourceText": "4. FR4: A new password must be at least 12 characters and contain at least one letter and one number. If it does not meet these rules, the system rejects it and shows the specific unmet rule(s).",
        "sourceRequirementId": "FR4",
        "toActor": "System",
        "precondition": "User is on the password reset form; User enters a new Password that meets all rules",
        "postcondition": "User has submitted a valid new Password",
        "description": "The User submits a new password for their Account to the System."
      },
      {
        "stepId": "5",
        "actor": "System",
        "action": "invalidate",
        "businessObject": "Password Reset Link",
        "sourceText": "5. FR5: On successful password change, the system invalidates the reset link, invalidates all existing login sessions for that account, and displays a confirmation that the user can now log in with the new password.",
        "sourceRequirementId": "FR5",
        "precondition": "User has successfully submitted a valid new Password",
        "postcondition": "Password Reset Link invalidated",
        "description": "The System invalidates the Password Reset Link."
      },
      {
        "stepId": "5.1",
        "actor": "System",
        "action": "invalidate",
        "businessObject": "Login Session",
        "sourceText": "5. FR5: On successful password change, the system invalidates the reset link, invalidates all existing login sessions for that account, and displays a confirmation that the user can now log in with the new password.",
        "sourceRequirementId": "FR5",
        "precondition": "Password Reset Link invalidated",
        "postcondition": "Login Sessions for Account invalidated",
        "description": "The System invalidates all existing Login Sessions for the Account."
      },
      {
        "stepId": "5.2",
        "actor": "System",
        "action": "display",
        "businessObject": "Account",
        "sourceText": "5. FR5: On successful password change, the system invalidates the reset link, invalidates all existing login sessions for that account, and displays a confirmation that the user can now log in with the new password.",
        "sourceRequirementId": "FR5",
        "toActor": "User",
        "precondition": "Login Sessions for Account invalidated",
        "postcondition": "User informed of successful password change and ability to log in",
        "description": "The System displays a confirmation to the User that the password has been changed and they can now log in."
      }
    ]
  },
  "alternativeFlows": [
    {
      "flowId": "2a",
      "deviationPoint": "2",
      "triggerCondition": "Email does not match any registered account",
      "steps": [
        {
          "stepId": "2a1",
          "actor": "System",
          "action": "show",
          "businessObject": "Account",
          "sourceText": "2. FR2: If the email matches a registered account, the system sends a reset link to that email; the link is valid for 30 minutes from send time. If the email does not match any account, the system shows the same generic confirmation message (no account-enumeration signal).",
          "sourceRequirementId": "FR2",
          "toActor": "User",
          "precondition": "User has requested a password reset link for an Account; Email does not match any registered account",
          "postcondition": "Generic confirmation message displayed to User",
          "description": "The System shows a generic confirmation message to the User."
        }
      ]
    },
    {
      "flowId": "4a",
      "deviationPoint": "4",
      "triggerCondition": "User enters a new Password that does not meet rules",
      "steps": [
        {
          "stepId": "4a1",
          "actor": "System",
          "action": "reject",
          "businessObject": "Account",
          "sourceText": "4. FR4: A new password must be at least 12 characters and contain at least one letter and one number. If it does not meet these rules, the system rejects it and shows the specific unmet rule(s).",
          "sourceRequirementId": "FR4",
          "toActor": "User",
          "precondition": "User is on the password reset form; User enters a new Password that does not meet rules",
          "postcondition": "System displays specific unmet password rules to User",
          "description": "The System rejects the new password for the Account and displays the specific unmet rule(s) to the User."
        }
      ],
      "rejoinPoint": "3"
    }
  ],
  "exceptionFlows": [
    {
      "flowId": "3b",
      "deviationPoint": "3",
      "triggerCondition": "Password Reset Link is expired or already used",
      "steps": [
        {
          "stepId": "3b1",
          "actor": "System",
          "action": "show",
          "businessObject": "Password Reset Link",
          "sourceText": "6. FR6: If a reset link is expired or already used, the system shows an error and offers to send a new one (returning to FR1's flow).",
          "sourceRequirementId": "FR6",
          "toActor": "User",
          "precondition": "User clicks a Password Reset Link; Password Reset Link is expired or already used",
          "postcondition": "User is informed of invalid Password Reset Link and offered to send a new one",
          "description": "The System shows an error to the User indicating the Password Reset Link is invalid and offers to send a new one."
        }
      ],
      "rejoinPoint": "1"
    }
  ],
  "businessObjects": [
    "Account",
    "Password Reset Link",
    "Login Session"
  ],
  "relatedUseCases": []
}