{
  "sourceRequirements": [
    {
      "id": "FR1",
      "originalText": "1. FR1: A user on the login page can click \"Forgot password\" to enter their registered email address and request a reset link."
    },
    {
      "id": "FR2",
      "originalText": "2. FR2: If the email matches a registered account, the system sends a reset link to that email; the link is valid for 30 minutes from send time. If the email does not match any account, the system shows the same generic confirmation message (no account-enumeration signal)."
    },
    {
      "id": "FR3",
      "originalText": "3. FR3: Clicking a valid, unexpired reset link takes the user to a form to enter and confirm a new password."
    },
    {
      "id": "FR4",
      "originalText": "4. FR4: A new password must be at least 12 characters and contain at least one letter and one number. If it does not meet these rules, the system rejects it and shows the specific unmet rule(s)."
    },
    {
      "id": "FR5",
      "originalText": "5. FR5: On successful password change, the system invalidates the reset link, invalidates all existing login sessions for that account, and displays a confirmation that the user can now log in with the new password."
    },
    {
      "id": "FR6",
      "originalText": "6. FR6: If a reset link is expired or already used, the system shows an error and offers to send a new one (returning to FR1's flow)."
    }
  ],
  "useCaseId": "UC-PASSWORD-RESET",
  "intent": "Allows a user to reset their forgotten password.",
  "role": "User",
  "preconditions": [
    "User is on the login page"
  ],
  "postconditions": [
    "User is informed they can log in with the new Password"
  ],
  "basicFlow": {
    "steps": [
      {
        "stepId": "1",
        "actor": "User",
        "action": "request",
        "businessObject": "Password Reset Link",
        "sourceText": "1. FR1: A user on the login page can click \"Forgot password\" to enter their registered email address and request a reset link.",
        "sourceRequirementId": "FR1",
        "toActor": "System",
        "precondition": "User is on the login page",
        "postcondition": "System has received a request for a password reset link for a given email address",
        "description": "The User requests a Password Reset Link from the System."
      },
      {
        "stepId": "2",
        "actor": "System",
        "action": "send",
        "businessObject": "Password Reset Link",
        "sourceText": "2. FR2: If the email matches a registered account, the system sends a reset link to that email; the link is valid for 30 minutes from send time. If the email does not match any account, the system shows the same generic confirmation message (no account-enumeration signal).",
        "sourceRequirementId": "FR2",
        "toActor": "User",
        "precondition": "System has received a request for a password reset link for a registered email address",
        "postcondition": "Password Reset Link is sent to the user's email and is valid for 30 minutes",
        "description": "The System sends a Password Reset Link to the User."
      },
      {
        "stepId": "3",
        "actor": "User",
        "action": "click",
        "businessObject": "Password Reset Link",
        "sourceText": "3. FR3: Clicking a valid, unexpired reset link takes the user to a form to enter and confirm a new password.",
        "sourceRequirementId": "FR3",
        "toActor": "System",
        "precondition": "User has received a valid, unexpired Password Reset Link",
        "postcondition": "User is presented with a form to enter and confirm a new Password",
        "description": "The User clicks the Password Reset Link."
      },
      {
        "stepId": "4",
        "actor": "System",
        "action": "accept",
        "businessObject": "Password",
        "sourceText": "4. FR4: A new password must be at least 12 characters and contain at least one letter and one number. If it does not meet these rules, the system rejects it and shows the specific unmet rule(s).",
        "sourceRequirementId": "FR4",
        "precondition": "User has entered a new Password that meets the specified rules (at least 12 characters, one letter, one number)",
        "postcondition": "New Password is accepted by the system for further processing",
        "description": "The System accepts the new Password."
      },
      {
        "stepId": "5",
        "actor": "System",
        "action": "invalidate",
        "businessObject": "Password Reset Link",
        "sourceText": "5. FR5: On successful password change, the system invalidates the reset link, invalidates all existing login sessions for that account, and displays a confirmation that the user can now log in with the new password.",
        "sourceRequirementId": "FR5",
        "precondition": "New Password has been successfully accepted and changed for the Account",
        "postcondition": "Password Reset Link is invalidated",
        "description": "The System invalidates the Password Reset Link."
      },
      {
        "stepId": "6",
        "actor": "System",
        "action": "invalidate",
        "businessObject": "Login Session",
        "sourceText": "5. FR5: On successful password change, the system invalidates the reset link, invalidates all existing login sessions for that account, and displays a confirmation that the user can now log in with the new password.",
        "sourceRequirementId": "FR5",
        "precondition": "Password Reset Link is invalidated",
        "postcondition": "All existing Login Sessions for the Account are invalidated",
        "description": "The System invalidates all existing Login Sessions for the Account."
      },
      {
        "stepId": "7",
        "actor": "System",
        "action": "display",
        "businessObject": "Account",
        "sourceText": "5. FR5: On successful password change, the system invalidates the reset link, invalidates all existing login sessions for that account, and displays a confirmation that the user can now log in with the new password.",
        "sourceRequirementId": "FR5",
        "toActor": "User",
        "precondition": "All existing Login Sessions for the Account are invalidated",
        "postcondition": "User is informed they can log in with the new Password",
        "description": "The System displays a confirmation to the User that they can now log in with the new password."
      }
    ]
  },
  "alternativeFlows": [
    {
      "flowId": "2a",
      "deviationPoint": "2",
      "triggerCondition": "If the email address provided by the User does not match a registered account.",
      "steps": [
        {
          "stepId": "2a1",
          "actor": "System",
          "action": "display",
          "businessObject": "Account",
          "sourceText": "2. FR2: If the email matches a registered account, the system sends a reset link to that email; the link is valid for 30 minutes from send time. If the email does not match any account, the system shows the same generic confirmation message (no account-enumeration signal).",
          "sourceRequirementId": "FR2",
          "toActor": "User",
          "precondition": "System has received a request for a password reset link for an unregistered email address",
          "postcondition": "User is shown a generic confirmation message; no account-enumeration signal is given",
          "description": "The System displays a generic confirmation message to the User, without revealing if the email is registered."
        }
      ]
    },
    {
      "flowId": "4a",
      "deviationPoint": "4",
      "triggerCondition": "If the new Password entered by the User does not meet the specified rules.",
      "steps": [
        {
          "stepId": "4a1",
          "actor": "System",
          "action": "reject",
          "businessObject": "Password",
          "sourceText": "4. FR4: A new password must be at least 12 characters and contain at least one letter and one number. If it does not meet these rules, the system rejects it and shows the specific unmet rule(s).",
          "sourceRequirementId": "FR4",
          "toActor": "User",
          "precondition": "User has entered a new Password that does not meet the specified rules",
          "postcondition": "System displays specific unmet rules to the User",
          "description": "The System rejects the Password and displays the specific unmet rules to the User."
        }
      ],
      "rejoinPoint": "3"
    }
  ],
  "exceptionFlows": [
    {
      "flowId": "3e",
      "deviationPoint": "3",
      "triggerCondition": "If the User attempts to click a Password Reset Link that is expired or already used.",
      "steps": [
        {
          "stepId": "3b1",
          "actor": "System",
          "action": "display",
          "businessObject": "Password Reset Link",
          "sourceText": "6. FR6: If a reset link is expired or already used, the system shows an error and offers to send a new one (returning to FR1's flow).",
          "sourceRequirementId": "FR6",
          "toActor": "User",
          "precondition": "User attempts to click a Password Reset Link that is expired or already used",
          "postcondition": "User is shown an error message and offered to send a new Password Reset Link",
          "description": "The System displays an error message to the User and offers to send a new Password Reset Link."
        }
      ],
      "rejoinPoint": "1"
    }
  ],
  "businessObjects": [
    "Account",
    "Password Reset Link",
    "Password",
    "Login Session"
  ],
  "relatedUseCases": []
}
